{
  "schema_version": "1.2.0",
  "title": "Orthogonal estimation literature",
  "search_scope": "Structural contract fixture referencing the existing catalog's orthogonal-scores source; no new search is claimed.",
  "coverage_limits": [
    "One source fixture; this is not a completed literature landscape."
  ],
  "papers": [
    {
      "entry_id": "entry.orthogonal_scores.theory",
      "source": {
        "schema_version": "1.0.0",
        "record_id": "record.literature_source.orthogonal_scores.2018",
        "generation_id": "generation.literature_source.001",
        "source_id": "citation.orthogonal_scores.2018",
        "source_type": "journal_article",
        "title": "Double or debiased machine learning for treatment and structural parameters",
        "authors": [
          "Victor Chernozhukov",
          "Denis Chetverikov",
          "Mert Demirer",
          "Esther Duflo",
          "Christian Hansen",
          "Whitney Newey",
          "James Robins"
        ],
        "year": 2018,
        "venue": "The Econometrics Journal",
        "identifiers": [
          {
            "kind": "doi",
            "value": "10.1111/ectj.12097"
          }
        ],
        "search_provenance": [
          {
            "run_id": "run.p1.literature.20260701t100000z",
            "role": "theorist",
            "search_source": "Crossref",
            "query": "orthogonal scores cross-fitting treatment effects",
            "searched_at": "2026-07-01T10:10:00Z"
          }
        ],
        "source_status": "active",
        "content_sha256": "2323232323232323232323232323232323232323232323232323232323232323",
        "created_at": "2026-07-01T11:00:00Z",
        "updated_at": "2026-07-01T11:00:00Z",
        "authority_at_creation": "formal_generation",
        "publication_receipt_id": "publication.p1.literature.003",
        "published_at": "2026-07-10T09:20:00Z"
      },
      "formulation_markdown": "Let $\\theta_0$ satisfy $\\mathbb E[\\psi(W;\\theta_0,\\eta_0)]=0$. Neyman orthogonality requires $\\left.\\partial_t\\mathbb E[\\psi(W;\\theta_0,\\eta_0+t h)]\\right|_{t=0}=0$ for admissible nuisance directions $h$. For a partition $I_1,\\ldots,I_K$ of the $n$ observations, train $\\widehat\\eta_{-k}$ without $I_k$. The pooled cross-fitted construction solves $$\\frac{1}{n}\\sum_{k=1}^K\\sum_{i\\in I_k}\\psi(W_i;\\widehat\\theta,\\widehat\\eta_{-k})=0.$$ The score, admissible nuisance directions, identification, regularity and nuisance convergence conditions, and rule for choosing a solution must be specified.",
      "explanation_markdown": "The source combines orthogonal scores with cross-fitting to estimate a target parameter $\\theta_0$ while learning nuisance functions $\\eta_0$ from observations $W_i$. A score $\\psi$ defines the target through $m(\\theta_0,\\eta_0)=0$, where $m(\\theta,\\eta)=\\mathbb E[\\psi(W;\\theta,\\eta)]$. Its orthogonality condition $$\\left.\\frac{d}{dt}m(\\theta_0,\\eta_0+t h)\\right|_{t=0}=0$$ for admissible nuisance perturbations $h$ removes first-order sensitivity of the population moment to nuisance error. For the pooled cross-fitted construction illustrated here, partition observations into folds $I_1,\\ldots,I_K$, fit $\\widehat\\eta_{-k}$ without fold $I_k$, and estimate the target from $$\\frac{1}{n}\\sum_{k=1}^K\\sum_{i\\in I_k}\\psi(W_i;\\widehat\\theta,\\widehat\\eta_{-k})=0.$$ Thus each observation is evaluated with nuisance fits trained on other folds. Identification, regularity and adequate nuisance convergence remain necessary for inference; the score and solution rule must be specified for the application. This structural fixture does not claim personal theorem verification.",
      "relevance_markdown": "The record supplies the orthogonal-score foundation for the existing method fixture.",
      "limitations_markdown": "Identification, moment regularity and appropriate nuisance convergence remain necessary; the equation alone is not a finite-sample guarantee.",
      "evidence_locations": [
        "Catalog source fixture: orthogonality condition"
      ],
      "reading_extent": "Structural fixture based on the existing catalog source record."
    }
  ],
  "proposed_questions": []
}
